[
  {
    "event_key": "user.activity_digest",
    "title": "Your Weekly Activity Summary",
    "template": "emails/digests/activity_summary.html",
    "channels": ["email"],
    "interval": "weekly",
    "group_by": "user_id",
    "digest": {
      "merge_strategy": "list_append",
      "max_items": 20
    }
  }
]